{
  "schema_version": "1.0",
  "mode": "PAPER",
  "market_calendar": "XNAS",
  "calendar_source": {
    "name": "exchange-calendars",
    "version": "replace-with-installed-version",
    "generated_at": "2026-08-17T00:00:00+00:00"
  },
  "expected_session_dates": [
    "2026-07-20",
    "2026-07-21",
    "2026-07-22",
    "2026-07-23",
    "2026-07-24",
    "2026-07-27",
    "2026-07-28",
    "2026-07-29",
    "2026-07-30",
    "2026-07-31",
    "2026-08-03",
    "2026-08-04",
    "2026-08-05",
    "2026-08-06",
    "2026-08-07",
    "2026-08-10",
    "2026-08-11",
    "2026-08-12",
    "2026-08-13",
    "2026-08-14"
  ],
  "missing_session_dates": [],
  "sessions": [
    {"session_date": "2026-07-20", "artifact": "sessions/2026-07-20.json", "sha256": "0000000000000000000000000000000000000000000000000000000000000000"},
    {"session_date": "2026-07-21", "artifact": "sessions/2026-07-21.json", "sha256": "0000000000000000000000000000000000000000000000000000000000000000"},
    {"session_date": "2026-07-22", "artifact": "sessions/2026-07-22.json", "sha256": "0000000000000000000000000000000000000000000000000000000000000000"},
    {"session_date": "2026-07-23", "artifact": "sessions/2026-07-23.json", "sha256": "0000000000000000000000000000000000000000000000000000000000000000"},
    {"session_date": "2026-07-24", "artifact": "sessions/2026-07-24.json", "sha256": "0000000000000000000000000000000000000000000000000000000000000000"},
    {"session_date": "2026-07-27", "artifact": "sessions/2026-07-27.json", "sha256": "0000000000000000000000000000000000000000000000000000000000000000"},
    {"session_date": "2026-07-28", "artifact": "sessions/2026-07-28.json", "sha256": "0000000000000000000000000000000000000000000000000000000000000000"},
    {"session_date": "2026-07-29", "artifact": "sessions/2026-07-29.json", "sha256": "0000000000000000000000000000000000000000000000000000000000000000"},
    {"session_date": "2026-07-30", "artifact": "sessions/2026-07-30.json", "sha256": "0000000000000000000000000000000000000000000000000000000000000000"},
    {"session_date": "2026-07-31", "artifact": "sessions/2026-07-31.json", "sha256": "0000000000000000000000000000000000000000000000000000000000000000"},
    {"session_date": "2026-08-03", "artifact": "sessions/2026-08-03.json", "sha256": "0000000000000000000000000000000000000000000000000000000000000000"},
    {"session_date": "2026-08-04", "artifact": "sessions/2026-08-04.json", "sha256": "0000000000000000000000000000000000000000000000000000000000000000"},
    {"session_date": "2026-08-05", "artifact": "sessions/2026-08-05.json", "sha256": "0000000000000000000000000000000000000000000000000000000000000000"},
    {"session_date": "2026-08-06", "artifact": "sessions/2026-08-06.json", "sha256": "0000000000000000000000000000000000000000000000000000000000000000"},
    {"session_date": "2026-08-07", "artifact": "sessions/2026-08-07.json", "sha256": "0000000000000000000000000000000000000000000000000000000000000000"},
    {"session_date": "2026-08-10", "artifact": "sessions/2026-08-10.json", "sha256": "0000000000000000000000000000000000000000000000000000000000000000"},
    {"session_date": "2026-08-11", "artifact": "sessions/2026-08-11.json", "sha256": "0000000000000000000000000000000000000000000000000000000000000000"},
    {"session_date": "2026-08-12", "artifact": "sessions/2026-08-12.json", "sha256": "0000000000000000000000000000000000000000000000000000000000000000"},
    {"session_date": "2026-08-13", "artifact": "sessions/2026-08-13.json", "sha256": "0000000000000000000000000000000000000000000000000000000000000000"},
    {"session_date": "2026-08-14", "artifact": "sessions/2026-08-14.json", "sha256": "0000000000000000000000000000000000000000000000000000000000000000"}
  ],
  "exceptions": []
}
